{
  "$schema": "http://json-schema.org/draft-07/schema#",
  "type": "object",
  "additionalProperties": false,
  "required": [
    "name",
    "title",
    "subtitle",
    "contact",
    "summary",
    "skills",
    "experience",
    "education",
    "languages"
  ],
  "properties": {
    "name": {
      "type": "string"
    },
    "title": {
      "type": "string"
    },
    "subtitle": {
      "type": "string"
    },
    "contact": {
      "type": "object",
      "additionalProperties": false,
      "required": ["email", "phone", "linkedin", "github", "location"],
      "properties": {
        "email": {
          "type": "string"
        },
        "phone": {
          "type": "string"
        },
        "linkedin": {
          "type": "string"
        },
        "github": {
          "type": "string"
        },
        "location": {
          "type": "string"
        }
      }
    },
    "summary": {
      "type": "string"
    },
    "skills": {
      "type": "array",
      "items": {
        "type": "string"
      }
    },
    "experience": {
      "type": "array",
      "items": {
        "type": "object",
        "additionalProperties": false,
        "required": ["title", "company", "period", "bullets"],
        "properties": {
          "title": {
            "type": "string"
          },
          "company": {
            "type": "string"
          },
          "period": {
            "type": "string"
          },
          "bullets": {
            "type": "array",
            "items": {
              "type": "string"
            }
          }
        }
      }
    },
    "education": {
      "type": "array",
      "items": {
        "type": "object",
        "additionalProperties": false,
        "required": ["degree", "institution", "period", "status"],
        "properties": {
          "degree": {
            "type": "string"
          },
          "institution": {
            "type": "string"
          },
          "period": {
            "type": "string"
          },
          "status": {
            "type": "string"
          }
        }
      }
    },
    "languages": {
      "type": "array",
      "items": {
        "type": "object",
        "additionalProperties": false,
        "required": ["language", "level"],
        "properties": {
          "language": {
            "type": "string"
          },
          "level": {
            "type": "string"
          }
        }
      }
    }
  }
}
